week,name,projected_points,actual_points,point_diff,pro_team,position,position_rank,weekly_outlook,receptions,rec_yards,rec_tds,rec_2pt_conversion,targets,rec_avg_yards,fumbles,receptions_proj,rec_yards_proj,rec_tds_proj,rec_2pt_conversion_proj,targets_proj,rec_avg_yards_proj,fumbles_proj
8,Christian McCaffrey,23.0,26.0,3.0,CAR,RB,1,"If not for being rested during a meaningless Week 17 game, McCaffrey would've led all backs in fantasy points last season. The Stanford product took his game to a new level in 2018, playing an almost unheard of 97 percent of Carolina's snaps through Week 16. He finished 10th among backs in rushing attempts (219) and was first in targets (124), receptions (107) and receiving yards (867). McCaffrey had at least five receiving touchdowns for the second year in a row. He improved his yards per carry from 3.7 to 5.0 and his catch rate from 73 percent to 86 percent. The 23-year-old does it all and is well worth the early-first-round fantasy investment.",,,,,,,,,,,,,,
8,Michael Thomas,22.18,28.0,5.82,NO,WR,1,"Thomas has been in the NFL for three seasons and has finished each of them as a top 7 fantasy wide receiver. Thomas has ranked top 7 at the position in targets, receptions and yardage during each of the past two seasons. He paced the league with 125 receptions last season thanks to an otherworldly 84 percent catch rate. Thanks, in part, to super-accurate Drew Brees, Thomas has posted a catch rate of at least 72 percent during each of his three NFL seasons. Thomas has yet to reach double-digit touchdowns and has never cleared seven end zone targets in a season, but his elite efficiency and hefty target volume in the Saints' high-scoring offense is plenty enough to allow top-end fantasy production. He's a solid first-round target.",11.0,112.0,1.0,0.0,11.0,10.182,0.0,8.143354825,101.5088629,0.672687645,0.037986931,10.68952177,12.46523884,0.037091087
8,Ezekiel Elliott,0.0,0.0,0.0,DAL,RB,4,"An absolute workhorse since entering the NFL in 2016, Elliott has played just under 90 percent of Dallas' snaps and handled over 80 percent of the carries when active over the past two seasons. That's led to a league-high 868 carries despite Elliott having missed eight games during that span. Elliott's game reached a new level last season as he easily reached career highs in targets (94), receptions (77) and receiving yards (567). Elliott led all backs in touches (381) and was second in scrimmage yards (2,001). His underwhelming usage near the goal line remains a concern (his 10 carries inside the 5 ranked 17th last season). Nonetheless, Elliott is a young, high-end talent set for a ton of volume. With his contract situation resolved, he should be off the board in the top 4 of every draft.",,,,,,,,,,,,,,
8,Travis Kelce,12.72,16.0,3.2799999999999994,KC,TE,1,"Kelce set career-high marks in pass routes (530), targets (149), receptions (103), receiving yards (1,336) and touchdowns (10) last season. As incredible as that achievement is, he did this after already leading all tight ends in fantasy points each of the previous two seasons. Since missing his rookie season with a knee injury, Kelce has finished a season no lower than eighth at the position in receptions, no lower than sixth in receiving yards, no lower than 12th in touchdowns and no lower than ninth in yards per target. The three-time No. 1 fantasy tight end handled 26 percent of Kansas City's targets last season and should be in that range again in 2019. The 29-year-old is your top option at the position and worth a look in the second round of your draft.",,,,,,,,,,,,,,
8,Julio Jones,15.68,25.0,9.32,ATL,WR,4,"Say what you want about Jones' occasional touchdown deficiencies, he arguably has been the league's best wide receiver since entering the league in 2011. Incredibly, Jones' yards per target has ranked inside the top 20 wide receivers all eight seasons of his career. Despite an unlucky 2017 season in the touchdown department (3 TDs, 8.4 OTD), Jones predictably regressed to the mean and found paydirt eight times (8.0 OTD) in 2018. He finished fourth in fantasy points and hasn't finished a season worse than seventh since 2013. Jones is 30, but his game hasn't slipped, and a role that allowed a position-best eight top 10 fantasy weeks in 2018 is unlikely to change. He's a rock solid top 5 fantasy wideout.",10.0,152.0,0.0,0.0,12.0,15.2,0.0,5.758270802,82.25384939,0.320777136,0.015729797,9.337885513,14.2844705,0.037799152
8,DeAndre Hopkins,16.75,21.0,4.25,HOU,WR,3,"Hopkins has been the No. 2 scoring fantasy wide receiver during each of the past two seasons and has finished in the top 4 three of the past four seasons. Hopkins has been a workhorse, ranking no lower than sixth in targets, receptions, yardage, touchdowns and end zone targets during each of the past two seasons. He has topped the position in OTD both seasons. Finally attached to a quality quarterback for a full season, Hopkins caught a career-high 70 percent of his targets in 2018. Hopkins has managed a massive 35 percent target share over the past two seasons. That could drop some with Kenny Stills, Will Fuller V and Keke Coutee in the mix, but Hopkins will still rank at or near the top of the position in the category. The sure-handed 27-year-old remains an elite fantasy asset.",11.0,109.0,0.0,0.0,13.0,9.909,0.0,6.149167963,78.1173251,0.599984975,0.025203996,9.17905305,12.70372278,0.02674458
8,Alvin Kamara,0.0,0.0,0.0,NO,RB,11,"Following as efficient a season as you'll find for any running back (let alone a rookie) in 2017, Kamara's 2018 went about as expected: He regressed to the mean, but still played at a high level and was a terrific fantasy asset. The former third-round pick finished top-eight among backs in snaps (628), touches (275), scrimmage yards (1592), offensive touchdowns (18) and fantasy points (354). Kamara has yet to clear 200 carries in a season, but he has caught 81 passes in both of his NFL seasons and saw a significant uptick in work near the goal line last season (his 14.5 OTD ranked second in the league). Kamara's role won't change much with Latavius Murray added to replace Mark Ingram II. The 23-year-old back remains a solid RB1 option.",,,,,,,,,,,,,,
8,Tyreek Hill,13.13,13.0,-0.13000000000000078,KC,WR,29,"Hill has seen his production increase during each of his NFL seasons. Fantasy's No. 19 scoring receiver as a rookie in 2016, Hill climbed to eighth in 2017 and to first in 2018. Though Hill's usage has progressively increased, he has made his hay with outstanding efficiency. He paced all wide receivers with an 11.5 YPT in 2017 and finished fifth at 10.9 last season. He also has ranked top 12 in YPR and RAC both seasons, while actually reaching a career high 14.7 aDOT last season (eighth highest). The versatile Hill has ranked second among wideouts in carries during each of his three seasons and has added four rushing and five return touchdowns along the way. Hill is a mid-range WR1 with upside to again pace the position in fantasy points.",6.0,76.0,0.0,0.0,9.0,12.667,0.0,4.827078032,68.97024399,0.310991422,0.010681952,7.520877163,14.28819744,0.02700113
8,Davante Adams,0.0,0.0,0.0,GB,WR,32,"Adams took his game to another level in 2018. In fact, before missing Week 17 because of an injury, Adams was the No. 1 scoring fantasy wide receiver. Incredibly, Adams ranked in the top 18 among wide receivers in all but one week last season (27th in Week 4) aside from the one week he missed. In addition to catching 13 touchdowns (second most), Adams ranked fourth at the position in routes (618), fourth in targets (164), fifth in receptions (111) and sixth in receiving yards (1,386). Adams has hauled in 35 touchdowns over the past three seasons, which trails only Antonio Brown for most in the league. Adams has done this damage despite missing at least one game three of the past four seasons. The 26-year-old soaked up a massive 30 percent target share last season and has little competition for targets again in 2019. He's a fine choice in the middle of the first round.",0.0,0.0,0.0,0.0,0.0,0.0,0.0,0.0,0.0,0.0,0.0,0.0,0.0,0.0
8,Saquon Barkley,18.51,27.0,8.489999999999998,NYG,RB,12,"Barkley was the second overall pick in the 2018 NFL draft and it's fair to say he'll be the first overall pick in most 2019 fantasy drafts. Barkley was a workhorse as a rookie, racking up 261 carries (second-most among running backs) and 119 targets (third-most), while pacing the position in routes (458), scrimmage yards (2,028) and fantasy points (386). Barkley finished worse than 13th at the position in fantasy points in only two weeks. He was on the field for 83 percent of the Giants' snaps, handled 75 percent of the designed runs and took on 21 percent of the targets. That workhorse usage isn't expected to change in what could be an even run-heavier offense in 2019. Barkley is the top asset in fantasy.",,,,,,,,,,,,,,
8,Patrick Mahomes,0.0,0.0,0.0,KC,QB,7,"If you took a shot on Mahomes late in your 2018 fantasy draft, congratulations, you probably won your league. Mahomes exploded onto the fantasy scene with 12 top-10 fantasy weeks en route to finishing as the top-scoring QB by 62 points over second-place Matt Ryan. Mahomes paced the league in passing touchdowns (50) and was second in passing yards (5,097), while adding 272 yards and two scores rushing. Entering his third season, Mahomes looks like the next great NFL quarterback -- and should be the top QB off the board in all drafts -- but history suggests we should expect a substantial statistical dip. Daunte Culpepper was the last to repeat as the No. 1 fantasy quarterback, and that was way back in 2003-04.",,,,,,,,,,,,,,
8,Lamar Jackson,0.0,0.0,0.0,BAL,QB,1,"Jackson took ""dual threat"" quarterback to a new level during his rookie season, setting an NFL single-season quarterback record with 147 carries despite starting only seven regular-season games. Jackson averaged a massive 17.0 carries per game and ranked seventh in the entire NFL with 556 rushing yards during his seven starts. Jackson did, however, struggle as a passer. He completed 58 percent of his passes (fourth worst) and was off target on 22 percent of his throws (second worst). The Baltimore offense averaged 1.9 touchdowns per game during Jackson's starts, which would have ranked seventh worst over the full season. Jackson's legs provide him with QB1 upside, but a lack of passing volume and efficiency, coupled with inherent durability concerns makes him more of a QB2 target.",,,,,,,,,,,,,,
8,George Kittle,13.61,14.0,0.39000000000000057,SF,TE,5,"After showing flashes of his massive ceiling as a fifth-round rookie in 2017, Kittle exploded for a tight-end record 1,377 receiving yards last season. The Iowa product also ranked first at the position RAC (9.7) and was third in targets (136), receptions (88), fantasy points (259) and YPR (15.6). The only area where Kittle was truly underwhelming was in the scoring department, as he managed only five touchdowns (5.8 OTD) and seven end-zone targets. The future is bright for the 25-year-old Kittle, who will sustain a massive target share in the 49ers' improving offense. Scoop him up in the third round of your draft.",,,,,,,,,,,,,,
8,Deshaun Watson,21.92,27.0,5.079999999999998,HOU,QB,2,"Watson picked up where he left off during an injury-shortened rookie season with a terrific sophomore campaign. The Clemson product was fantasy's No. 4 QB and his 10 top-10 fantasy weeks ranked third. Despite dealing with overwhelming pressure due to a weak offensive line (league-high 62 sacks), Watson ranked top 12 in passing yards (4,165) and touchdowns (26). He added 551 yards and five scores on 99 carries, all of which ranked third at the position. Watson is only 23 years old, adds value with his arm and legs, and will have a better and healthier supporting cast in 2019. He's a strong QB1.",,,,,,,,,,,,,,
8,Nick Chubb,15.22,10.0,-5.220000000000001,CLE,RB,8,"Chubb opened his NFL career buried behind both Carlos Hyde and Duke Johnson, but it didn't take long for the 2018 second-round pick to force his way into a massive role. Once he took over as the lead back in Week 7, Chubb handled 80 percent of the Browns' designed runs and 10 percent of the targets, and only seven backs scored more fantasy points. For the entire season, Chubb averaged 5.2 YPC (10th-highest at the position), including 2.41 after contact (seventh-best), and he averaged 0.53 fantasy points per snap, which was fourth-highest among backs. Chubb will open 2019 as Cleveland's clear feature back, though a limited role as a receiver and the return of Kareem Hunt around midseason limit his upside a bit. Chubb is best viewed as a strong RB2 in Cleveland's improved offense.",,,,,,,,,,,,,,
8,Leonard Fournette,19.34,20.0,0.6600000000000001,JAX,RB,6,"Fournette hasn't quite lived up to lofty expectations since being selected fourth overall in the 2017 draft. The 24-year-old back has already missed 11 games and has seen his yards per carry fall from 3.9 in 2017 to 3.3 (fifth-worst) in 2018. Though, in his defense, Fournette has dealt with a large number of stacked boxes and horrific quarterback play. On the plus side, an extensive workload near the goal line (19 carries inside the 5 in 21 games) and good receiving efficiency (82 percent catch rate, 8.4 YPR) have helped him to two straight seasons finishing top-12 in fantasy points per game. Fournette's Trent Richardson-like efficiency woes are a concern, but the addition QB Nick Foles and massive volume he receives keep him in the RB1 discussion and offer hope for a breakout season.",,,,,,,,,,,,,,
8,Amari Cooper,0.0,0.0,0.0,DAL,WR,11,"Cooper kicked off his career with a pair of 1,000-yard and top 25 fantasy seasons in Oakland, but it took a trade to Dallas last season for him to really take off. Cooper, who handled 21 percent target share in Oakland, had a career-high 25 percent share in 11 games with Dallas. In fact, he never fell below a 16 percent share in a single game and was fantasy's No. 9 wide receiver from Week 9 on. Cooper's boost in volume coincided with improved efficiency (he caught a career-high 71 percent of his targets and averaged a career-best 9.5 YPT), which is enough to make the 25-year-old a strong WR2 with top-10 upside.",0.0,0.0,0.0,0.0,0.0,0.0,0.0,0.0,0.0,0.0,0.0,0.0,0.0,0.0
8,Todd Gurley II,16.06,10.0,-6.059999999999999,LAR,RB,13,"After Gurley was the consensus No. 1 overall pick in 2018 fantasy drafts, his stock is down following an injury-fueled slow finish to the season. Gurley is expected to be fully healthy for 2019, of course, which means you may actually be able to get a discount on a player who scored 21 touchdowns in 14 games last season. The 24-year-old workhorse missed two games but still ranked fourth among backs in snaps, touches and scrimmage yards. He has paced running backs in fantasy points per game and top-10 fantasy weeks each of the past two seasons. Concerns about Gurley's knee remain, which has knocked down his fantasy stock, but his massive fantasy upside makes him a fine choice in Round 2.",,,,,,,,,,,,,,
8,Zach Ertz,11.95,4.0,-7.949999999999999,PHI,TE,2,"Ertz set the all-time tight end record with 116 receptions last season and was fantasy's No. 2 scorer at the position. Incredibly, Ertz has improved his fantasy point total each of his seasons in the NFL and has now posted four consecutive top-nine finishes. He paced all tight ends in snaps (949), routes (550) and targets (156), while ranking top-four in receiving yards (1,163), touchdowns (eight) and end-zone targets (nine) last season. After struggling in the area during his first four seasons, Ertz has scored exactly eight touchdowns in back-to-back seasons. The 28-year-old is an elite, high-floor fantasy option who could defer some targets to DeSean Jackson and Dallas Goedert and still post a top-three fantasy season. He'll cost you a third-round pick this season.",,,,,,,,,,,,,,
8,Aaron Jones,16.15,40.0,23.85,GB,RB,5,"For the second consecutive season, Jones was one of the league's more efficient running backs in 2018, but a limited role and missed games precluded the 2017 fifth-round pick from consistent fantasy production. Jones has missed four games in each of the past two seasons but has averaged a healthy 5.5 YPC during both campaigns. Despite playing only 51 percent of the snaps, Jones posted a trio of top-10 fantasy weeks and ranked 13th at the position in fantasy points during the 11 weeks in which he wasn't out or injured last season. With a new coaching staff in place, Jones is the favorite to lead a committee with Jamaal Williams this season. Jones will be positioned for around 200 carries and a modest receiving role, which should allow for solid RB2 numbers.",,,,,,,,,,,,,,
8,Russell Wilson,20.65,15.0,-5.649999999999999,SEA,QB,3,"Wilson paced all quarterbacks in fantasy scoring by 49 points in 2017, but Seattle's move to a run-heavy offense led to a dip all the way to ninth in 2018. Wilson posted eight top-10 outings (fifth most), but failed to clear 29 points in a single week. Wilson's 427 pass attempts ranked 20th and were his fewest since 2013. Wilson is a strong candidate for touchdown regression to the mean (his 8.2 percent TD rate ranks third over the past decade). Offensive line remains a concern after Wilson was sacked on 10.7 percent of his dropbacks (fifth highest). Wilson is extremely efficient and adds value with his legs, but Seattle's commitment to a run-heavy offense limits his fantasy upside. He's a back-end QB1.",,,,,,,,,,,,,,
8,Chris Carson,18.9,15.0,-3.8999999999999986,SEA,RB,10,"The Seahawks drafted a running back (Rashaad Penny) in the first round of the 2018 draft, but that didn't stop second-year Carson from taking a firm grasp of lead back duties last season. Carson posted 247 carries (seventh-most) for 1,151 yards (fifth-most) and nine scores (seventh-most) in 14 games as the lead back in Seattle's run-heavy offense. Carson averaged 2.29 yards after contact (11th-best) and, though he played a minimal role as a receiver, caught all but three of his 23 targets. Seattle's run-heavy scheme will be back in 2019, and Carson's terrific second season gives him the leg up on Penny for the bulk of the backfield touches. Carson is expected to see a boost in receiving work, as well, so he'll touch the ball more than enough to allow RB2 numbers.",,,,,,,,,,,,,,
8,Julian Edelman,14.97,27.0,12.03,NE,WR,5,"Edelman was suspended for the first four games of the 2018 season but still managed a 74/850/6 line during 12 regular-season games. Tom Brady's top target was limited to one top 10 fantasy week but finished only one of 12 outings worse than 30th, making him the second-safest bet for a top-30 week behind only Davante Adams. Edelman is averaging a massive 9.4 targets per game over the past five seasons and reached eight targets in nine of 12 games in 2018. Durability is the notable drawback as he has missed 45 of 160 possible regular-season games (28 percent) since joining the team in 2009. Edelman is now 33, but following Rob Gronkowski's retirement, he's ticketed for a gigantic offensive role. Consider him a strong WR2 option.",8.0,78.0,2.0,0.0,11.0,9.75,0.0,5.790611631,70.17552867,0.365263978,0.010972147,8.944659861,12.11884567,0.041592579
8,Le'Veon Bell,15.74,6.0,-9.74,NYJ,RB,15,"Bell has signed on with the Jets after infamously sitting out the entire 2018 season due to a contract dispute. A longtime NFL workhorse, Bell ranked first among running backs in snaps (3,449), fourth in carries (1,229), third in rushing yards (5,336), fourth in rushing touchdowns (35), first in targets (390) and first in receiving yards (312) from 2013-17 despite missing 18 of 80 possible games. Bell, who has appeared in all 16 regular-season games once in his career, saw his efficiency take a dip in 2017, but pacing the position in rushes and receptions was enough to help him post his third top-three-overall fantasy season in four years. Jets coach Adam Gase's tendency to pass near the goal line (NFL-low 23 carries inside the 5 during his three seasons in Miami) could cost Bell some touchdowns, but the former Steeler won't have trouble generating big volume in an improving offense. He's a solid RB1.",,,,,,,,,,,,,,
8,Keenan Allen,10.37,12.0,1.6300000000000008,LAC,WR,8,"After missing 26 games (including at least one each season) during his first four NFL seasons, Allen has appeared in all 32 of the Chargers games during the past two regular seasons. In fact, he has been on the field for 91 percent of the team's pass plays and has handled a hefty 28 percent target share. Allen has finished no lower than 13th at the position in targets, receptions, receiving yards and fantasy points during each of the past two seasons. If there's a concern area, it's touchdowns, as Allen hasn't scored more than six in a season since his rookie campaign in 2013. Allen's 5.4 OTD last season suggests he was fortunate to even reach six scores. Allen is in his prime at age 27 and one of the game's most effective receivers. Philip Rivers' top target is a safe back-end WR1.",7.0,53.0,0.0,0.0,10.0,7.571,0.0,4.309751739,55.05716353,0.182237162,0.008391826,6.779126441,12.77501974,0.024172054
8,Mark Ingram II,0.0,0.0,0.0,BAL,RB,9,"Ingram joins the Ravens after an eight-year stint in New Orleans. Following a slow start to his career, Ingram has averaged 4.73 YPC, including 2.10 after contact, the past six seasons. Those marks rank first and second, respectively, among 31 backs with 650 carries in that span. Ingram ranks second in the league in rushing touchdowns (39), second in rushing OTD (37.5) and tied for first in carries inside the opponent's 5-yard line (61) the past five seasons. The 29-year-old Ingram is a strong bet to pace the extremely run-heavy Ravens' backfield in carries and possibly targets. Ingram has a real shot to eclipse his previous career-high carry total of 230 (2017). He's a flex option who can be upgraded slightly in non-PPR.",,,,,,,,,,,,,,
8,Patriots D/ST,8.57,20.0,11.43,NE,DST,1,"All eyes are usually on the New England offense, but the Patriots' defense has been good for a long time. In fact, their D/ST has posted seven top-10 fantasy campaigns the past nine seasons. New England struggled to only 30 sacks last season (third-fewest) but made up for it with 28 forced turnovers (fifth) and four touchdowns (tied for seventh). The Patriots ranked seventh in points allowed (325) and have ranked top-10 in the category 12 of the past 13 seasons. Fantasy's reigning No. 6 D/ST lost Trey Flowers, Malcom Brown and star returner Cordarrelle Patterson but added Michael Bennett to a core that includes Stephon Gilmore, Devin McCourty and Lawrence Guy. This is an average group on paper, but it is led by a coach who always maximizes his talent. As usual, the Patriots' D/ST is a back-end starting option.",,,,,,,,,,,,,,
8,Tyler Lockett,13.58,16.0,2.42,SEA,WR,14,"Lockett defied logic last season by posting an absurd 57/965/10 line on only 68 targets. Lockett had posted between 64 and 69 targets during each of his first three NFL seasons but never cleared 51 receptions, 664 yards or six touchdowns. Lockett, who hasn't dropped a pass since 2016, caught 84 percent of his targets (second best), posted a 14.2 YPT (best) and scored on 14.7 percent of his targets (second best). Lockett was fantasy's No. 16 receiver (his first career top 40) despite managing only one weekly finish better than 14th. Needless to say, Lockett's efficiency isn't close to sustainable and that includes touchdowns (he scored 10 times despite a 3.0 OTD and seven end zone targets). Lockett is a very good player but he needs more volume to be more than a WR3/flex option. He figures to get it following Doug Baldwin's retirement.",6.0,100.0,0.0,0.0,6.0,16.667,0.0,4.42941175,62.69409216,0.468644772,0.019340959,5.887725029,14.15404476,0.023306599
8,Cooper Kupp,13.72,35.0,21.28,LAR,WR,5,"Kupp has been a solid fantasy asset since being selected in the third round of the 2017 draft, but a pair of injuries derailed what would've been a major breakout in 2018. During the seven full games he played with Brandin Cooks and Robert Woods last season, Kupp handled a solid 22 percent target share (7.3 per game) and ranked eighth in fantasy points. Kupp scored six touchdowns during those seven games (though his 2.7 OTD suggests he was over his head in that department). He also ranked third among receivers with a 77 percent catch rate, fourth with a 10.9 YPT, and second with a 7.6 RAC last season. The 26-year-old has the look of a solid WR2 play.",7.0,220.0,1.0,0.0,10.0,31.429,0.0,5.419175486,65.64681569,0.364620259,0.021208849,8.076595104,12.11380142,0.023165833
8,Derrick Henry,14.68,6.0,-8.68,TEN,RB,7,"It isn't often that a player has nearly as many rushing touchdowns as he has receptions, but that was the case for Henry last season. The oversized back rushed for 12 scores (third-most) thanks to 13 carries inside the 5 (fourth-most). Despite playing a situational role most of the season, Henry's 238-yard, four-touchdown effort in Week 14 vaulted him into a larger role down the stretch. He was the top-scoring fantasy back by 17 points from that point on. Henry has been very efficient as a rusher (top-three in YAC each of the past two seasons) but has yet to clear 15 receptions in a season. He's expected to take on the largest role of his career in 2019, but that doesn't figure to mean much of an uptick in targets. That limits him to RB2 territory, but upgrade him in non-PPR.",,,,,,,,,,,,,,
